A1: Code no. | B1: IRB | C1: 5.1 | D1: News A | E1: News B | F1: 6.1 | G1: 7.1 | H1: 8.1 | I1: 9.1 | J1: 14.1 | K1: Midterm | L1: Course | M1: Cookies | N1: Cookies Regr | O1: Poll | P1: Term Paper | Q1: Final Exam | R1: Course | S1: Grade
A2: 102 | B2: 100 | C2: 100 | D2: 100 | E2: 100 | F2: 100 | G2: 100 | H2: 95 | I2: 93 | J2: 98 | K2: 87 | L2: =((SUM(B2:J2,M2:O2)/12)*25 + (K2*20) + (Q2*20) + (P2*35))/100 -> 91.5 | M2: 90 | N2: 100 | O2: 100 | P2: 92 | Q2: 87 | R2: 91.5 | S2: P
A3: 125 | B3: 100 | C3: 100 | D3: 100 | E3: 100 | F3: 100 | G3: 95 | H3: 95 | I3: 100 | J3: 95 | K3: 60 | L3: =((SUM(B3:J3,M3:O3)/12)*25 + (K3*20) + (Q3*20) + (P3*35))/100 -> 85.529166666666683 | M3: 90 | N3: 100 | O3: 100 | P3: 95 | Q3: 79 | R3: 85.5 | S3: P
A4: 148 | B4: 100 | C4: 100 | D4: 100 | E4: 100 | F4: 100 | G4: 100 | H4: 100 | I4: 94 | J4: 100 | K4: 90 | L4: =((SUM(B4:J4,M4:O4)/12)*25 + (K4*20) + (Q4*20) + (P4*35))/100 -> 92.01666666666668 | M4: 90 | N4: 100 | O4: 100 | P4: 97 | Q4: 77 | R4: 92.0 | S4: P
A5: 171 | B5: 100 | C5: 100 | D5: 100 | E5: 100 | F5: 100 | G5: 100 | H5: 100 | I5: 96 | J5: 100 | K5: 85 | L5: =((SUM(B5:J5,M5:O5)/12)*25 + (K5*20) + (Q5*20) + (P5*35))/100 -> 87.85833333333332 | M5: 80 | N5: 98 | O5: 100 | P5: 84 | Q5: 85 | R5: 87.9 | S5: P
A6: 194 | B6: 100 | C6: 100 | D6: 100 | E6: 100 | F6: 100 | G6: 100 | H6: 100 | I6: 96 | J6: 95 | K6: 87 | L6: =((SUM(B6:J6,M6:O6)/12)*25 + (K6*20) + (Q6*20) + (P6*35))/100 -> 88.804166666666674 | M6: 90 | N6: 100 | O6: 100 | P6: 84 | Q6: 87 | R6: 88.8 | S6: P
A7: 217 | B7: 100 | C7: 100 | D7: 100 | E7: 100 | F7: 100 | G7: 100 | H7: 100 | I7: 100 | J7: 92 | K7: 97 | L7: =((SUM(B7:J7,M7:O7)/12)*25 + (K7*20) + (Q7*20) + (P7*35))/100 -> 90.720833333333317 | M7: 90 | N7: 95 | O7: 100 | P7: 84 | Q7: 87 | R7: 90.7 | S7: P
A8: 240 | B8: 100 | C8: 99 | D8: 100 | E8: 100 | F8: 80 | G8: 98 | H8: 67 | I8: 100 | J8: 95 | K8: 99 | L8: =((SUM(B8:J8,M8:O8)/12)*25 + (K8*20) + (Q8*20) + (P8*35))/100 -> 94.679166666666674 | M8: 100 | N8: 100 | O8: 100 | P8: 97 | Q8: 86 | R8: 94.7 | S8: H
A9: 263 | B9: 100 | C9: 100 | D9: 100 | E9: 100 | F9: 95 | G9: 100 | H9: 87 | I9: 97 | J9: 95 | K9: 82 | L9: =((SUM(B9:J9,M9:O9)/12)*25 + (K9*20) + (Q9*20) + (P9*35))/100 -> 88.25 | M9: 90 | N9: 100 | O9: 100 | P9: 88 | Q9: 84 | R9: 88.3 | S9: P
A10: 286 | B10: 100 | C10: 100 | D10: 100 | E10: 100 | F10: 50 | G10: 100 | H10: 100 | I10: 96 | J10: 95 | K10: 57 | L10: =((SUM(B10:J10,M10:O10)/12)*25 + (K10*20) + (Q10*20) + (P10*35))/100 -> 80.366666666666674 | M10: 95 | N10: 100 | O10: 100 | P10: 90 | Q10: 69 | R10: 80.4 | S10: P
A11: 309 | B11: 100 | C11: 100 | D11: 100 | E11: 100 | F11: 90 | G11: 100 | H11: 100 | I11: 98 | J11: 95 | K11: 90 | L11: =((SUM(B11:J11,M11:O11)/12)*25 + (K11*20) + (Q11*20) + (P11*35))/100 -> 93.283333333333317 | M11: 85 | N11: 100 | O11: 100 | P11: 97 | Q11: 85 | R11: 93.3 | S11: P
A12: 332 | B12: 100 | C12: 98 | D12: 100 | E12: 100 | F12: 100 | G12: 95 | H12: 100 | I12: 94 | J12: 80 | K12: 72 | L12: =((SUM(B12:J12,M12:O12)/12)*25 + (K12*20) + (Q12*20) + (P12*35))/100 -> 86.504166666666677 | M12: 90 | N12: 100 | O12: 100 | P12: 92 | Q12: 79 | R12: 86.5 | S12: P
A13: 355 | B13: 100 | C13: 100 | D13: 100 | E13: 100 | F13: 88 | G13: 100 | H13: 96 | I13: 98 | J13: 100 | K13: 91 | L13: =((SUM(B13:J13,M13:O13)/12)*25 + (K13*20) + (Q13*20) + (P13*35))/100 -> 94.404166666666683 | M13: 100 | N13: 99 | O13: 100 | P13: 92 | Q13: 97 | R13: 94.4 | S13: H
A14: 378 | B14: 100 | C14: 100 | D14: 100 | E14: 100 | F14: 100 | G14: 100 | H14: 100 | I14: 100 | J14: 90 | K14: 102 | L14: =((SUM(B14:J14,M14:O14)/12)*25 + (K14*20) + (Q14*20) + (P14*35))/100 -> 92.98333333333332 | M14: 90 | N14: 100 | O14: 100 | P14: 92 | Q14: 79 | R14: 93.0 | S14: P
A15: 401 | B15: 100 | C15: 100 | D15: 100 | E15: 100 | F15: 75 | G15: 100 | H15: 97 | I15: 96 | J15: 85 | K15: 93 | L15: =((SUM(B15:J15,M15:O15)/12)*25 + (K15*20) + (Q15*20) + (P15*35))/100 -> 92.57916666666668 | M15: 90 | N15: 0 | O15: 100 | P15: 95 | Q15: 95 | R15: 92.6 | S15: P
A16: 424 | B16: 100 | C16: 100 | D16: 100 | E16: 100 | F16: 100 | G16: 100 | H16: 100 | I16: 100 | J16: 90 | K16: 99 | L16: =((SUM(B16:J16,M16:O16)/12)*25 + (K16*20) + (Q16*20) + (P16*35))/100 -> 92.76666666666668 | M16: 95 | N16: 99 | O16: 100 | P16: 90 | Q16: 84 | R16: 92.8 | S16: P
A17: 447 | B17: 100 | C17: 99 | D17: 100 | E17: 100 | F17: 100 | G17: 100 | H17: 90 | I17: 98 | J17: 95 | K17: 96 | L17: =((SUM(B17:J17,M17:O17)/12)*25 + (K17*20) + (Q17*20) + (P17*35))/100 -> 89.712500000000006 | M17: 90 | N17: 95 | O17: 100 | P17: 84 | Q17: 84 | R17: 89.7 | S17: P
A18: 470 | B18: 100 | C18: 100 | D18: 0 | E18: 100 | F18: 0 | G18: 0 | H18: 93 | I18: 0 | J18: 54 | K18: 92 | L18: =((SUM(B18:J18,M18:O18)/12)*25 + (K18*20) + (Q18*20) + (P18*35))/100 -> 82.291666666666657 | M18: 90 | N18: 85 | O18: 100 | P18: 95 | Q18: 78 | R18: 82.3 | S18: P
A19: 493 | B19: 100 | C19: 100 | D19: 100 | E19: 100 | F19: 100 | G19: 90 | H19: 100 | I19: 100 | J19: 90 | K19: 99 | L19: =((SUM(B19:J19,M19:O19)/12)*25 + (K19*20) + (Q19*20) + (P19*35))/100 -> 90.666666666666686 | M19: 85 | N19: 95 | O19: 100 | P19: 90 | Q19: 76 | R19: 90.7 | S19: P
A20: 516 | B20: 100 | C20: 95 | D20: 100 | E20: 100 | F20: 95 | G20: 90 | H20: 100 | I20: 100 | J20: 93 | K20: 70 | L20: =((SUM(B20:J20,M20:O20)/12)*25 + (K20*20) + (Q20*20) + (P20*35))/100 -> 88.837500000000006 | M20: 100 | N20: 100 | O20: 100 | P20: 92 | Q20: 91 | R20: 88.8 | S20: P
A21: 539 | B21: 100 | C21: 100 | D21: 100 | E21: 100 | F21: 95 | G21: 100 | H21: 100 | I21: 92 | J21: 95 | K21: 73 | L21: =((SUM(B21:J21,M21:O21)/12)*25 + (K21*20) + (Q21*20) + (P21*35))/100 -> 88.762500000000003 | M21: 90 | N21: 95 | O21: 100 | P21: 95 | Q21: 83 | R21: 88.8 | S21: P
A22: 562 | B22: 100 | C22: 100 | D22: 100 | E22: 100 | F22: 80 | G22: 100 | H22: 95 | I22: 98 | J22: 95 | K22: 69 | L22: =((SUM(B22:J22,M22:O22)/12)*25 + (K22*20) + (Q22*20) + (P22*35))/100 -> 86.720833333333317 | M22: 90 | N22: 95 | O22: 100 | P22: 90 | Q22: 87 | R22: 86.7 | S22: P
A23: 585 | B23: 100 | C23: 100 | D23: 100 | E23: 100 | F23: 95 | G23: 100 | H23: 100 | I23: 100 | J23: 95 | K23: 93 | L23: =((SUM(B23:J23,M23:O23)/12)*25 + (K23*20) + (Q23*20) + (P23*35))/100 -> 90.583333333333314 | M23: 90 | N23: 100 | O23: 100 | P23: 88 | Q23: 83 | R23: 90.6 | S23: P
A24: 608 | B24: 100 | C24: 99 | D24: 100 | E24: 100 | F24: 98 | G24: 95 | H24: 95 | I24: 94 | J24: 90 | K24: 74 | L24: =((SUM(B24:J24,M24:O24)/12)*25 + (K24*20) + (Q24*20) + (P24*35))/100 -> 87.9375 | M24: 90 | N24: 100 | O24: 100 | P24: 97 | Q24: 75 | R24: 87.9 | S24: P
A25: 631 | B25: 100 | C25: 100 | D25: 100 | E25: 100 | F25: 100 | G25: 90 | H25: 100 | I25: 99 | J25: 95 | K25: 81 | L25: =((SUM(B25:J25,M25:O25)/12)*25 + (K25*20) + (Q25*20) + (P25*35))/100 -> 92.258333333333326 | M25: 90 | N25: 100 | O25: 100 | P25: 92 | Q25: 97 | R25: 92.3 | S25: P
A26: 654 | B26: 100 | C26: 90 | D26: 100 | E26: 100 | F26: 100 | G26: 95 | H26: 99 | I26: 94 | J26: 95 | K26: 89 | L26: =((SUM(B26:J26,M26:O26)/12)*25 + (K26*20) + (Q26*20) + (P26*35))/100 -> 92.724999999999994 | M26: 90 | N26: 95 | O26: 100 | P26: 92 | Q26: 93 | R26: 92.7 | S26: P
A27: 677 | B27: 100 | C27: 100 | D27: 100 | E27: 100 | F27: 80 | G27: 100 | H27: 95 | I27: 100 | J27: 100 | K27: 53 | L27: =((SUM(B27:J27,M27:O27)/12)*25 + (K27*20) + (Q27*20) + (P27*35))/100 -> 81.870833333333337 | M27: 90 | N27: 100 | O27: 100 | P27: 88 | Q27: 81 | R27: 81.9 | S27: P
A28: 700 | B28: 100 | C28: 100 | D28: 100 | E28: 100 | F28: 95 | G28: 100 | H28: 100 | I28: 100 | J28: 91 | K28: 57 | L28: =((SUM(B28:J28,M28:O28)/12)*25 + (K28*20) + (Q28*20) + (P28*35))/100 -> 81.75 | M28: 95 | N28: 95 | O28: 100 | P28: 95 | Q28: 63 | R28: 81.8 | S28: P
A29: 723 | B29: 100 | C29: 100 | D29: 100 | E29: 100 | F29: 100 | G29: 100 | H29: 100 | I29: 100 | J29: 88 | K29: 92 | L29: =((SUM(B29:J29,M29:O29)/12)*25 + (K29*20) + (Q29*20) + (P29*35))/100 -> 90.929166666666674 | M29: 100 | N29: 99 | O29: 100 | P29: 92 | Q29: 78 | R29: 90.9 | S29: P
A30: 746 | B30: 100 | C30: 100 | D30: 100 | E30: 100 | F30: 90 | G30: 100 | H30: 100 | I30: 100 | J30: 95 | K30: 91 | L30: =((SUM(B30:J30,M30:O30)/12)*25 + (K30*20) + (Q30*20) + (P30*35))/100 -> 92.870833333333323 | M30: 90 | N30: 90 | O30: 100 | P30: 92 | Q30: 91 | R30: 92.9 | S30: P
A31: 769 | B31: 100 | C31: 100 | D31: 100 | E31: 100 | F31: 100 | G31: 99 | H31: 100 | I31: 94 | J31: 92 | K31: 90 | L31: =((SUM(B31:J31,M31:O31)/12)*25 + (K31*20) + (Q31*20) + (P31*35))/100 -> 92.087500000000006 | M31: 100 | N31: 100 | O31: 100 | P31: 92 | Q31: 86 | R31: 92.1 | S31: P
A32: 792 | B32: 100 | C32: 100 | D32: 100 | E32: 100 | F32: 100 | G32: 95 | H32: 100 | I32: 92 | J32: 90 | K32: 90 | L32: =((SUM(B32:J32,M32:O32)/12)*25 + (K32*20) + (Q32*20) + (P32*35))/100 -> 93.616666666666674 | M32: 100 | N32: 95 | O32: 100 | P32: 92 | Q32: 95 | R32: 93.6 | S32: P
A33: 815 | B33: 100 | C33: 98 | D33: 100 | E33: 100 | F33: 100 | G33: 100 | H33: 100 | I33: 98 | J33: 95 | K33: 99 | L33: =((SUM(B33:J33,M33:O33)/12)*25 + (K33*20) + (Q33*20) + (P33*35))/100 -> 93.004166666666677 | M33: 90 | N33: 100 | O33: 100 | P33: 88 | Q33: 89 | R33: 93.0 | S33: P
A34: 838 | B34: 100 | C34: 100 | D34: 100 | E34: 100 | F34: 100 | G34: 100 | H34: 100 | I34: 100 | J34: 90 | K34: 101 | L34: =((SUM(B34:J34,M34:O34)/12)*25 + (K34*20) + (Q34*20) + (P34*35))/100 -> 95.012500000000003 | M34: 90 | N34: 99 | O34: 100 | P34: 95 | Q34: 85 | R34: 95.0 | S34: H
A35: 861 | B35: 100 | C35: 100 | D35: 100 | E35: 100 | F35: 80 | G35: 100 | H35: 100 | I35: 100 | J35: 97 | K35: 76 | L35: =((SUM(B35:J35,M35:O35)/12)*25 + (K35*20) + (Q35*20) + (P35*35))/100 -> 90.5625 | M35: 90 | N35: 100 | O35: 100 | P35: 95 | Q35: 89 | R35: 90.6 | S35: P
A36: 884 | B36: 100 | C36: 100 | D36: 100 | E36: 100 | F36: 100 | G36: 98 | H36: 100 | I36: 100 | J36: 90 | K36: 91 | L36: =((SUM(B36:J36,M36:O36)/12)*25 + (K36*20) + (Q36*20) + (P36*35))/100 -> 94.791666666666686 | M36: 90 | N36: 100 | O36: 100 | P36: 95 | Q36: 94 | R36: 94.8 | S36: H
A37: 907 | B37: 100 | C37: 100 | D37: 100 | E37: 100 | F37: 100 | G37: 90 | H37: 100 | I37: 78 | J37: 90 | K37: 102 | L37: =((SUM(B37:J37,M37:O37)/12)*25 + (K37*20) + (Q37*20) + (P37*35))/100 -> 92.51666666666668 | M37: 100 | N37: 90 | O37: 100 | P37: 92 | Q37: 80 | R37: 92.5 | S37: P